property,value,unit,source,source_url,retrieved_at,notes
atomic_mass,231.03588,u,PubChem Periodic Table,https://pubchem.ncbi.nlm.nih.gov/rest/pug/periodictable/JSON,2026-07-10T13:14:56+00:00,Valor publicado por PubChem.
electron_configuration,[Rn]7s2 5f2 6d1,,PubChem Periodic Table,https://pubchem.ncbi.nlm.nih.gov/rest/pug/periodictable/JSON,2026-07-10T13:14:56+00:00,Configuración electrónica.
electronegativity,1.5,Pauling,PubChem Periodic Table,https://pubchem.ncbi.nlm.nih.gov/rest/pug/periodictable/JSON,2026-07-10T13:14:56+00:00,Escala de Pauling cuando se proporciona.
atomic_radius,243,pm,PubChem Periodic Table,https://pubchem.ncbi.nlm.nih.gov/rest/pug/periodictable/JSON,2026-07-10T13:14:56+00:00,Radio atómico publicado por PubChem.
ionization_energy,5.89,eV,PubChem Periodic Table,https://pubchem.ncbi.nlm.nih.gov/rest/pug/periodictable/JSON,2026-07-10T13:14:56+00:00,Primera energía de ionización cuando se proporciona.
standard_atomic_weight,231.035 88(1),u,CIAAW / IUPAC,https://www.ciaaw.org/atomic-weights.htm,2026-07-10T13:14:59+00:00,"Se conserva la notación publicada, incluidos intervalos o valores entre corchetes."
